{
  "schemaVersion": 1,
  "profileId": "certifying-review-four-slot-v1",
  "chairProfiles": [
    {
      "targetChairFamily": "openai",
      "slots": [
        {
          "slot": "native",
          "adapterClass": "primary-native",
          "adapterId": "codex-app-server",
          "providerFamily": "openai",
          "model": "gpt-6-astra",
          "requiredActualEndpointProvider": "openai",
          "requestedEffort": "max",
          "resolvedEffort": {
            "kind": "applied",
            "value": "max"
          },
          "sourceMode": "direct-portal",
          "providerTurnCeiling": 128,
          "internalStepCeiling": 0,
          "mandatoryReadOps": 80,
          "mandatoryReadBytes": 6291456,
          "explorationReadOps": 32,
          "explorationReadBytes": 4194304,
          "routeAliases": [
            "flagship"
          ],
          "riskReadMapDigest": "sha256:c8a4e424157f52c9e09165017ae717fa02798e4edab80e6388fa101816ef004d"
        },
        {
          "slot": "other-primary",
          "adapterClass": "equal-primary",
          "adapterId": "claude-agent-sdk",
          "providerFamily": "anthropic",
          "model": "claude-opus-5",
          "requiredActualEndpointProvider": "anthropic",
          "requestedEffort": "xhigh",
          "resolvedEffort": {
            "kind": "applied",
            "value": "xhigh"
          },
          "sourceMode": "direct-portal",
          "providerTurnCeiling": 128,
          "internalStepCeiling": 0,
          "mandatoryReadOps": 80,
          "mandatoryReadBytes": 6291456,
          "explorationReadOps": 32,
          "explorationReadBytes": 4194304,
          "routeAliases": [
            "flagship"
          ],
          "riskReadMapDigest": "sha256:c8a4e424157f52c9e09165017ae717fa02798e4edab80e6388fa101816ef004d"
        },
        {
          "slot": "cursor-grok",
          "adapterClass": "cursor",
          "adapterId": "cursor-agent",
          "providerFamily": "xai",
          "model": "cursor-grok-4.5-high",
          "requiredActualEndpointProvider": "xai",
          "requestedEffort": null,
          "resolvedEffort": {
            "kind": "inapplicable"
          },
          "sourceMode": "portal-helper",
          "providerTurnCeiling": 1,
          "internalStepCeiling": 128,
          "mandatoryReadOps": 80,
          "mandatoryReadBytes": 6291456,
          "explorationReadOps": 48,
          "explorationReadBytes": 4194304,
          "routeAliases": [
            "cursor-grok-4.5-high"
          ],
          "riskReadMapDigest": "sha256:c8a4e424157f52c9e09165017ae717fa02798e4edab80e6388fa101816ef004d"
        },
        {
          "slot": "agy-gemini",
          "adapterClass": "agy",
          "adapterId": "agy",
          "providerFamily": "google",
          "model": "Gemini 3.1 Pro (High)",
          "requiredActualEndpointProvider": "google",
          "requestedEffort": null,
          "resolvedEffort": {
            "kind": "inapplicable"
          },
          "sourceMode": "portal-helper",
          "providerTurnCeiling": 1,
          "internalStepCeiling": 128,
          "mandatoryReadOps": 80,
          "mandatoryReadBytes": 6291456,
          "explorationReadOps": 48,
          "explorationReadBytes": 4194304,
          "routeAliases": [
            "Gemini 3.1 Pro (High)"
          ],
          "riskReadMapDigest": "sha256:c8a4e424157f52c9e09165017ae717fa02798e4edab80e6388fa101816ef004d"
        }
      ]
    },
    {
      "targetChairFamily": "anthropic",
      "slots": [
        {
          "slot": "native",
          "adapterClass": "primary-native",
          "adapterId": "claude-agent-sdk",
          "providerFamily": "anthropic",
          "model": "claude-opus-5",
          "requiredActualEndpointProvider": "anthropic",
          "requestedEffort": "xhigh",
          "resolvedEffort": {
            "kind": "applied",
            "value": "xhigh"
          },
          "sourceMode": "direct-portal",
          "providerTurnCeiling": 128,
          "internalStepCeiling": 0,
          "mandatoryReadOps": 80,
          "mandatoryReadBytes": 6291456,
          "explorationReadOps": 32,
          "explorationReadBytes": 4194304,
          "routeAliases": [
            "flagship"
          ],
          "riskReadMapDigest": "sha256:c8a4e424157f52c9e09165017ae717fa02798e4edab80e6388fa101816ef004d"
        },
        {
          "slot": "other-primary",
          "adapterClass": "equal-primary",
          "adapterId": "codex-app-server",
          "providerFamily": "openai",
          "model": "gpt-6-astra",
          "requiredActualEndpointProvider": "openai",
          "requestedEffort": "max",
          "resolvedEffort": {
            "kind": "applied",
            "value": "max"
          },
          "sourceMode": "direct-portal",
          "providerTurnCeiling": 128,
          "internalStepCeiling": 0,
          "mandatoryReadOps": 80,
          "mandatoryReadBytes": 6291456,
          "explorationReadOps": 32,
          "explorationReadBytes": 4194304,
          "routeAliases": [
            "flagship"
          ],
          "riskReadMapDigest": "sha256:c8a4e424157f52c9e09165017ae717fa02798e4edab80e6388fa101816ef004d"
        },
        {
          "slot": "cursor-grok",
          "adapterClass": "cursor",
          "adapterId": "cursor-agent",
          "providerFamily": "xai",
          "model": "cursor-grok-4.5-high",
          "requiredActualEndpointProvider": "xai",
          "requestedEffort": null,
          "resolvedEffort": {
            "kind": "inapplicable"
          },
          "sourceMode": "portal-helper",
          "providerTurnCeiling": 1,
          "internalStepCeiling": 128,
          "mandatoryReadOps": 80,
          "mandatoryReadBytes": 6291456,
          "explorationReadOps": 48,
          "explorationReadBytes": 4194304,
          "routeAliases": [
            "cursor-grok-4.5-high"
          ],
          "riskReadMapDigest": "sha256:c8a4e424157f52c9e09165017ae717fa02798e4edab80e6388fa101816ef004d"
        },
        {
          "slot": "agy-gemini",
          "adapterClass": "agy",
          "adapterId": "agy",
          "providerFamily": "google",
          "model": "Gemini 3.1 Pro (High)",
          "requiredActualEndpointProvider": "google",
          "requestedEffort": null,
          "resolvedEffort": {
            "kind": "inapplicable"
          },
          "sourceMode": "portal-helper",
          "providerTurnCeiling": 1,
          "internalStepCeiling": 128,
          "mandatoryReadOps": 80,
          "mandatoryReadBytes": 6291456,
          "explorationReadOps": 48,
          "explorationReadBytes": 4194304,
          "routeAliases": [
            "Gemini 3.1 Pro (High)"
          ],
          "riskReadMapDigest": "sha256:c8a4e424157f52c9e09165017ae717fa02798e4edab80e6388fa101816ef004d"
        }
      ]
    }
  ],
  "pinObservations": [
    {
      "providerFamily": "openai",
      "model": "gpt-5.6-sol",
      "routeAlias": "flagship",
      "observedOn": "2026-07-26",
      "observedVia": "codex-model-catalogue"
    },
    {
      "providerFamily": "anthropic",
      "model": "claude-opus-5",
      "routeAlias": "flagship",
      "observedOn": "2026-07-26",
      "observedVia": "claude-subscription-canary"
    },
    {
      "providerFamily": "xai",
      "model": "cursor-grok-4.5-high",
      "routeAlias": "cursor-grok-4.5-high",
      "observedOn": "2026-07-16",
      "observedVia": "manual-attestation"
    },
    {
      "providerFamily": "google",
      "model": "Gemini 3.1 Pro (High)",
      "routeAlias": "Gemini 3.1 Pro (High)",
      "observedOn": "2026-07-16",
      "observedVia": "manual-attestation"
    }
  ]
}
